ID,NAME,PARENT_ID,DESCRIPTION,ORDERING
1,Other Traits,0,A specialised ability not covered by any other heading,100
2,Talents,0,What you intuitively know,1
3,Skills,0,"Learned through training, apprenticeships or other instruction",2
4,Knowledges,0,The application of the mind rather than the body,3
5,Hobby Talents,1,Mainly self-taught and usually more active than intellectual,4
6,Professional Skills,2,Mainly taught and primarily active in application,5
7,Expert Knowledges,3,Anything primarily intellectual or mental in nature and must be studied,6
